all_awardings,approved_at_utc,approved_by,archived,author,author_flair_background_color,author_flair_css_class,author_flair_richtext,author_flair_template_id,author_flair_text,author_flair_text_color,author_flair_type,author_fullname,author_patreon_flair,banned_at_utc,banned_by,can_gild,can_mod_post,category,clicked,content_categories,contest_mode,created,created_utc,distinguished,domain,downs,edited,gilded,gildings,hidden,hide_score,id,is_crosspostable,is_meta,is_original_content,is_reddit_media_domain,is_robot_indexable,is_self,is_video,likes,link_flair_background_color,link_flair_css_class,link_flair_richtext,link_flair_template_id,link_flair_text,link_flair_text_color,link_flair_type,locked,media,media_embed,media_only,mod_note,mod_reason_by,mod_reason_title,mod_reports,name,no_follow,num_comments,num_crossposts,num_reports,over_18,parent_whitelist_status,permalink,pinned,post_hint,preview,pwls,quarantine,removal_reason,report_reasons,saved,score,secure_media,secure_media_embed,selftext,selftext_html,send_replies,spoiler,stickied,subreddit,subreddit_id,subreddit_name_prefixed,subreddit_subscribers,subreddit_type,suggested_sort,thumbnail,thumbnail_height,thumbnail_width,title,total_awards_received,ups,url,user_reports,view_count,visited,whitelist_status,wls
[],,,False,AutoModerator,#d0fffd,,"[{'e': 'text', 't': 'ðŸ¤–'}]",326005ee-9cf2-11e8-8b1f-0e8f9a199476,ðŸ¤–,dark,richtext,t2_6l4z3,False,,,False,False,,False,,False,1559912524.0,1559883724.0,moderator,self.boardgames,0,False,0,{},False,False,bxqpl8,False,False,False,False,True,True,False,,#4a4b4a,,"[{'e': 'text', 't': 'Daily Game Recs'}]",01476204-cd40-11e7-a8ba-0e829f432fc8,Daily Game Recs,light,richtext,False,,{},False,,,,[],t3_bxqpl8,True,12,1,,False,all_ads,/r/boardgames/comments/bxqpl8/rboardgames_daily_discussion_and_game/,False,,,6,False,,,False,3,,{},"**Welcome to /r/boardgames Daily Discussion and Game Recommendations**

This is meant to be a place where you can ask any and all questions relating to the board gaming world: general or specific game recommendations, rule clarifications, definitions of terms/acronyms, and other quick questions that might not warrant their own post. 

If you are seeking game recommendations you will get better responses if you give us enough background to help you. You can use [this template](https://www.reddit.com/r/boardgames/wiki/personalized-game-recommendation-template-no-explainer) to do so. [Here](https://www.reddit.com/r/boardgames/wiki/personalized-game-recommendation-template) is a version with explanations of what we're looking for.  

If you reply to any comment that has a game name in **bold** with ""**/u/r2d8 getparentinfo**"", one of our robots will tell you more about the game

Just remember that this is a community full of awesome, helpful people, and feel free to ask your questions whatever they may be. As always, keep it civil and remember what the downvote button is actually for.


Lastly, here are some of the resources available at /r/boardgames:

* If you are new here, be sure to check out our [Community Guidelines](https://www.reddit.com/r/boardgames/wiki/community)
* If you are looking for a game recommendation, make sure to read our [What Should I Get Wiki](https://www.reddit.com/r/boardgames/wiki/wsig)
* If asking people for recommendations is too interactive: [The Automated Recommendations Robot is here for you](https://www.reddit.com/r/boardgames/wiki/wsig#wiki_ask_a_robot_for_a_list_of_recommendations).
* Also take a look at our [Wiki Index](https://www.reddit.com/r/boardgames/wiki/index) for various other resources and information.
* Any questions about game design can be answered here, but also visit /r/tabletopgamedesign
* Any discussions about the subreddit itself should be contained in /r/metaboardgames

*If you use the boardgamerecommender bot in this thread, please reply to the stickied top comment in order to avoid cluttering up the posts.*

Happy gaming!","&lt;!-- SC_OFF --&gt;&lt;div class=""md""&gt;&lt;p&gt;&lt;strong&gt;Welcome to &lt;a href=""/r/boardgames""&gt;/r/boardgames&lt;/a&gt; Daily Discussion and Game Recommendations&lt;/strong&gt;&lt;/p&gt;

&lt;p&gt;This is meant to be a place where you can ask any and all questions relating to the board gaming world: general or specific game recommendations, rule clarifications, definitions of terms/acronyms, and other quick questions that might not warrant their own post. &lt;/p&gt;

&lt;p&gt;If you are seeking game recommendations you will get better responses if you give us enough background to help you. You can use &lt;a href=""https://www.reddit.com/r/boardgames/wiki/personalized-game-recommendation-template-no-explainer""&gt;this template&lt;/a&gt; to do so. &lt;a href=""https://www.reddit.com/r/boardgames/wiki/personalized-game-recommendation-template""&gt;Here&lt;/a&gt; is a version with explanations of what we&amp;#39;re looking for.  &lt;/p&gt;

&lt;p&gt;If you reply to any comment that has a game name in &lt;strong&gt;bold&lt;/strong&gt; with &amp;quot;&lt;strong&gt;&lt;a href=""/u/r2d8""&gt;/u/r2d8&lt;/a&gt; getparentinfo&lt;/strong&gt;&amp;quot;, one of our robots will tell you more about the game&lt;/p&gt;

&lt;p&gt;Just remember that this is a community full of awesome, helpful people, and feel free to ask your questions whatever they may be. As always, keep it civil and remember what the downvote button is actually for.&lt;/p&gt;

&lt;p&gt;Lastly, here are some of the resources available at &lt;a href=""/r/boardgames""&gt;/r/boardgames&lt;/a&gt;:&lt;/p&gt;

&lt;ul&gt;
&lt;li&gt;If you are new here, be sure to check out our &lt;a href=""https://www.reddit.com/r/boardgames/wiki/community""&gt;Community Guidelines&lt;/a&gt;&lt;/li&gt;
&lt;li&gt;If you are looking for a game recommendation, make sure to read our &lt;a href=""https://www.reddit.com/r/boardgames/wiki/wsig""&gt;What Should I Get Wiki&lt;/a&gt;&lt;/li&gt;
&lt;li&gt;If asking people for recommendations is too interactive: &lt;a href=""https://www.reddit.com/r/boardgames/wiki/wsig#wiki_ask_a_robot_for_a_list_of_recommendations""&gt;The Automated Recommendations Robot is here for you&lt;/a&gt;.&lt;/li&gt;
&lt;li&gt;Also take a look at our &lt;a href=""https://www.reddit.com/r/boardgames/wiki/index""&gt;Wiki Index&lt;/a&gt; for various other resources and information.&lt;/li&gt;
&lt;li&gt;Any questions about game design can be answered here, but also visit &lt;a href=""/r/tabletopgamedesign""&gt;/r/tabletopgamedesign&lt;/a&gt;&lt;/li&gt;
&lt;li&gt;Any discussions about the subreddit itself should be contained in &lt;a href=""/r/metaboardgames""&gt;/r/metaboardgames&lt;/a&gt;&lt;/li&gt;
&lt;/ul&gt;

&lt;p&gt;&lt;em&gt;If you use the boardgamerecommender bot in this thread, please reply to the stickied top comment in order to avoid cluttering up the posts.&lt;/em&gt;&lt;/p&gt;

&lt;p&gt;Happy gaming!&lt;/p&gt;
&lt;/div&gt;&lt;!-- SC_ON --&gt;",False,False,True,boardgames,t5_2qmjp,r/boardgames,1933285,public,new,self,,,"/r/boardgames Daily Discussion and Game Recommendations (June 07, 2019)",0,3,https://www.reddit.com/r/boardgames/comments/bxqpl8/rboardgames_daily_discussion_and_game/,[],,False,all_ads,6
[],,,False,Chromie121,,,[],,,,text,t2_3l8ovkct,False,,,False,False,,False,,False,1559883207.0,1559854407.0,,self.boardgames,0,False,0,{},False,False,bxluh6,False,False,False,False,True,True,False,,,,[],,,dark,text,False,,{},False,,,,[],t3_bxluh6,False,18,0,,False,all_ads,/r/boardgames/comments/bxluh6/gloomhaven_digital_first_gameplay_reveal_on_twitch/,False,self,"{'images': [{'source': {'url': 'https://external-preview.redd.it/BCelFqPsebmlCry4OdJJPeeqCk0h-_L5BHGgUBl1B5E.jpg?auto=webp&amp;s=9f0b3817f2a80da80a5852fe9f46d288f1796dfa', 'width': 640, 'height': 360}, 'resolutions': [{'url': 'https://external-preview.redd.it/BCelFqPsebmlCry4OdJJPeeqCk0h-_L5BHGgUBl1B5E.jpg?width=108&amp;crop=smart&amp;auto=webp&amp;s=1fc27ac939fa11885f5bb6bb058e144958af2f67', 'width': 108, 'height': 60}, {'url': 'https://external-preview.redd.it/BCelFqPsebmlCry4OdJJPeeqCk0h-_L5BHGgUBl1B5E.jpg?width=216&amp;crop=smart&amp;auto=webp&amp;s=175d18e920bd508dea369e091036e800b25b0904', 'width': 216, 'height': 121}, {'url': 'https://external-preview.redd.it/BCelFqPsebmlCry4OdJJPeeqCk0h-_L5BHGgUBl1B5E.jpg?width=320&amp;crop=smart&amp;auto=webp&amp;s=be7860780d9231bcfa890719b6fbaf40dba9296c', 'width': 320, 'height': 180}, {'url': 'https://external-preview.redd.it/BCelFqPsebmlCry4OdJJPeeqCk0h-_L5BHGgUBl1B5E.jpg?width=640&amp;crop=smart&amp;auto=webp&amp;s=fcd4d00f58355f374b3d09c1c03fe9b944ed9d50', 'width': 640, 'height': 360}], 'variants': {}, 'id': 'K95vGpmEy4hcpxddJIv7eC4UywXn41r_C39agwqX7mM'}], 'enabled': False}",6,False,,,False,277,,{},"Asmodee Digital had a stream today for [Gloomhaven right here!](https://www.twitch.tv/videos/435226448)

Early Access will be [July 17th](https://store.steampowered.com/app/780290/Gloomhaven/)

I'm very excited, I actually just found a Gloomhaven group and will finally get a chance to play next weekend.","&lt;!-- SC_OFF --&gt;&lt;div class=""md""&gt;&lt;p&gt;Asmodee Digital had a stream today for &lt;a href=""https://www.twitch.tv/videos/435226448""&gt;Gloomhaven right here!&lt;/a&gt;&lt;/p&gt;

&lt;p&gt;Early Access will be &lt;a href=""https://store.steampowered.com/app/780290/Gloomhaven/""&gt;July 17th&lt;/a&gt;&lt;/p&gt;

&lt;p&gt;I&amp;#39;m very excited, I actually just found a Gloomhaven group and will finally get a chance to play next weekend.&lt;/p&gt;
&lt;/div&gt;&lt;!-- SC_ON --&gt;",True,False,False,boardgames,t5_2qmjp,r/boardgames,1933285,public,,self,,,Gloomhaven Digital - First Gameplay Reveal on Twitch!,0,277,https://www.reddit.com/r/boardgames/comments/bxluh6/gloomhaven_digital_first_gameplay_reveal_on_twitch/,[],,False,all_ads,6
[],,,False,bungeeman,,blood-bowl,"[{'e': 'text', 't': 'Blood Bowl'}]",197491da-18aa-11e7-bae6-0ef608c792b0,Blood Bowl,dark,richtext,t2_9s7j7,False,,,False,False,,False,,False,1559849233.0,1559820433.0,,self.boardgames,0,1559837786.0,0,{},False,False,bxfm4v,False,False,False,False,True,True,False,,,,[],,,dark,text,False,,{},False,,,,[],t3_bxfm4v,False,223,0,,False,all_ads,/r/boardgames/comments/bxfm4v/please_be_nice_to_the_guys_demonstrating_games_at/,False,,,6,False,,,False,883,,{},"Edit: So it has become quite apparent that I need to clarify a few things:

- I know that this is not a particularly bad experience. It's supposed to be an example, not some kind of sympathy drive. I too have worked the hellhole that is retail and service. I've had people yell in my face, spit at me, try to fight me, all because they got sold the wrong cable or received a dirty glass. I just don't want some poor unsuspecting kid to have their first experiences of working at a convention be wrecked by one of these people.

- The example interaction was not a jokey, flirty exchange of banter. It was an adult human yelling at me. I don't care that she yelled at me. In fact, I laughed at her with the next group of people who approached the booth. The tale serves to illustrate my point. It is not supposed to be a story of the most traumatic experience of my thirties.

You don't need to tell me how sensitive I am or how terrible you have it at [Insert Retail Outlet Here]. However, if it makes you feel better to get it off your chest, please go ahead.

**Original Post**

I've been to my fair share of cons, but last weekend was my first time seeing them from the other side of the bar. I had a blast, met some awesome people and got my ass kicked at Star Realms. It was a truly awesome experience.

However, I was honestly shocked at the way some people spoke to my fellow demonstrators and wanted to bring this up here and perhaps clear up a few things.

First off, here is an actual interaction I had with an attendee.

It was the busiest day of the convention and our game had already booked up all of its demo slots by mid-morning. Unfortunately, that meant I had to disappoint a lot of people, most of whom were really cool about it and many of whom remarked on how awesome it was that we were so popular. It was at this point that an American Lady approached us.

Me = Me / AL = American Lady

AL: ""Hi, I'd like to book a slot for your game""

Me: ""I'm very sorry, but I'm afraid we're fully booked up for the whole day, but...""

AL: ""Can I book one for tomorrow then?""

Me: ""Once again, really sorry, but we're only taking on-the-day bookings to give single day ticket holders a fair chance at getting a game. If you come back early tomorrow, I can book you in.""

AL: ""So I'm not special enough to book for tomorrow then?""

Me: ""Nobody is. The only fair way to go about this is to treat everybody equally, but if you...""

AL: ""I see how it is"" *proceeds to storm away in a tantrum*

I wish this was an isolated incident, but it was by no means the only time I saw this kind of interaction.

I realise most of you already know this and I'm effectively preaching to the choir, but the demo guys at conventions are almost all volunteers, giving up their whole weekend to add a little bit of variety to your con. You don't need to thank them, after all, they want to be there, but at least be nice to them.

This kind of behaviour is not cool when visited upon actual paid employees, but it's really quite indefensible to speak to a volunteer like that. I'd hate to think that some bright-eyed, young, first-time demonstrator might be put off of ever volunteering again because some mean attendee made them feel like crap.

I get it. It's humid, stuffy, noisy in the hall. You've just had to re-mortgage your apartment to afford an overpriced cheeseburger and a cup of stale coffee, and now that game you really wanted to try out is denied you, despite you paying a fair bit of cash for a ticket to attend, but it isn't anyone's fault.

It certainly isn't the fault of the happy, smiling nerd who would have informed you that the whole team had volunteered to run games in a local bar all evening for those who were disappointed, had you only let him finish any of his sentences.

In the words of Bill S. Preston, ""be excellent to each other"".","&lt;!-- SC_OFF --&gt;&lt;div class=""md""&gt;&lt;p&gt;Edit: So it has become quite apparent that I need to clarify a few things:&lt;/p&gt;

&lt;ul&gt;
&lt;li&gt;&lt;p&gt;I know that this is not a particularly bad experience. It&amp;#39;s supposed to be an example, not some kind of sympathy drive. I too have worked the hellhole that is retail and service. I&amp;#39;ve had people yell in my face, spit at me, try to fight me, all because they got sold the wrong cable or received a dirty glass. I just don&amp;#39;t want some poor unsuspecting kid to have their first experiences of working at a convention be wrecked by one of these people.&lt;/p&gt;&lt;/li&gt;
&lt;li&gt;&lt;p&gt;The example interaction was not a jokey, flirty exchange of banter. It was an adult human yelling at me. I don&amp;#39;t care that she yelled at me. In fact, I laughed at her with the next group of people who approached the booth. The tale serves to illustrate my point. It is not supposed to be a story of the most traumatic experience of my thirties.&lt;/p&gt;&lt;/li&gt;
&lt;/ul&gt;

&lt;p&gt;You don&amp;#39;t need to tell me how sensitive I am or how terrible you have it at [Insert Retail Outlet Here]. However, if it makes you feel better to get it off your chest, please go ahead.&lt;/p&gt;

&lt;p&gt;&lt;strong&gt;Original Post&lt;/strong&gt;&lt;/p&gt;

&lt;p&gt;I&amp;#39;ve been to my fair share of cons, but last weekend was my first time seeing them from the other side of the bar. I had a blast, met some awesome people and got my ass kicked at Star Realms. It was a truly awesome experience.&lt;/p&gt;

&lt;p&gt;However, I was honestly shocked at the way some people spoke to my fellow demonstrators and wanted to bring this up here and perhaps clear up a few things.&lt;/p&gt;

&lt;p&gt;First off, here is an actual interaction I had with an attendee.&lt;/p&gt;

&lt;p&gt;It was the busiest day of the convention and our game had already booked up all of its demo slots by mid-morning. Unfortunately, that meant I had to disappoint a lot of people, most of whom were really cool about it and many of whom remarked on how awesome it was that we were so popular. It was at this point that an American Lady approached us.&lt;/p&gt;

&lt;p&gt;Me = Me / AL = American Lady&lt;/p&gt;

&lt;p&gt;AL: &amp;quot;Hi, I&amp;#39;d like to book a slot for your game&amp;quot;&lt;/p&gt;

&lt;p&gt;Me: &amp;quot;I&amp;#39;m very sorry, but I&amp;#39;m afraid we&amp;#39;re fully booked up for the whole day, but...&amp;quot;&lt;/p&gt;

&lt;p&gt;AL: &amp;quot;Can I book one for tomorrow then?&amp;quot;&lt;/p&gt;

&lt;p&gt;Me: &amp;quot;Once again, really sorry, but we&amp;#39;re only taking on-the-day bookings to give single day ticket holders a fair chance at getting a game. If you come back early tomorrow, I can book you in.&amp;quot;&lt;/p&gt;

&lt;p&gt;AL: &amp;quot;So I&amp;#39;m not special enough to book for tomorrow then?&amp;quot;&lt;/p&gt;

&lt;p&gt;Me: &amp;quot;Nobody is. The only fair way to go about this is to treat everybody equally, but if you...&amp;quot;&lt;/p&gt;

&lt;p&gt;AL: &amp;quot;I see how it is&amp;quot; &lt;em&gt;proceeds to storm away in a tantrum&lt;/em&gt;&lt;/p&gt;

&lt;p&gt;I wish this was an isolated incident, but it was by no means the only time I saw this kind of interaction.&lt;/p&gt;

&lt;p&gt;I realise most of you already know this and I&amp;#39;m effectively preaching to the choir, but the demo guys at conventions are almost all volunteers, giving up their whole weekend to add a little bit of variety to your con. You don&amp;#39;t need to thank them, after all, they want to be there, but at least be nice to them.&lt;/p&gt;

&lt;p&gt;This kind of behaviour is not cool when visited upon actual paid employees, but it&amp;#39;s really quite indefensible to speak to a volunteer like that. I&amp;#39;d hate to think that some bright-eyed, young, first-time demonstrator might be put off of ever volunteering again because some mean attendee made them feel like crap.&lt;/p&gt;

&lt;p&gt;I get it. It&amp;#39;s humid, stuffy, noisy in the hall. You&amp;#39;ve just had to re-mortgage your apartment to afford an overpriced cheeseburger and a cup of stale coffee, and now that game you really wanted to try out is denied you, despite you paying a fair bit of cash for a ticket to attend, but it isn&amp;#39;t anyone&amp;#39;s fault.&lt;/p&gt;

&lt;p&gt;It certainly isn&amp;#39;t the fault of the happy, smiling nerd who would have informed you that the whole team had volunteered to run games in a local bar all evening for those who were disappointed, had you only let him finish any of his sentences.&lt;/p&gt;

&lt;p&gt;In the words of Bill S. Preston, &amp;quot;be excellent to each other&amp;quot;.&lt;/p&gt;
&lt;/div&gt;&lt;!-- SC_ON --&gt;",True,False,False,boardgames,t5_2qmjp,r/boardgames,1933285,public,,self,,,Please be nice to the guys demonstrating games at conventions,0,883,https://www.reddit.com/r/boardgames/comments/bxfm4v/please_be_nice_to_the_guys_demonstrating_games_at/,[],,False,all_ads,6
