[],,,False,mrsardo,,,[],,,,text,t2_597d3,False,,,False,False,,False,,False,1559821539.0,1559792739.0,,self.boardgames,0,1559793199.0,0,{},False,False,bxc235,False,False,False,False,True,True,False,,,,[],,,dark,text,False,,{},False,,,,[],t3_bxc235,False,16,0,,False,all_ads,/r/boardgames/comments/bxc235/favorite_examples_of_zero_sum_games/,False,self,"{'images': [{'source': {'url': 'https://external-preview.redd.it/myq8Br13ER50NUIOVM_E2nEUBPvjZaRYsfRhPaI6BFk.jpg?auto=webp&amp;s=1e716cb0bad3ce136cca63f262a6a04b55e4bdf6', 'width': 398, 'height': 630}, 'resolutions': [{'url': 'https://external-preview.redd.it/myq8Br13ER50NUIOVM_E2nEUBPvjZaRYsfRhPaI6BFk.jpg?width=108&amp;crop=smart&amp;auto=webp&amp;s=cb49001dc815b63c635269fe22ca96973af51aa6', 'width': 108, 'height': 170}, {'url': 'https://external-preview.redd.it/myq8Br13ER50NUIOVM_E2nEUBPvjZaRYsfRhPaI6BFk.jpg?width=216&amp;crop=smart&amp;auto=webp&amp;s=77158564ce5dd4ea96e401f6cac528f3625ac12c', 'width': 216, 'height': 341}, {'url': 'https://external-preview.redd.it/myq8Br13ER50NUIOVM_E2nEUBPvjZaRYsfRhPaI6BFk.jpg?width=320&amp;crop=smart&amp;auto=webp&amp;s=814048d6cb64f721356cf1f933a2fa078a5f5c03', 'width': 320, 'height': 506}], 'variants': {}, 'id': '9fDdeh9I8oCsDTOLpHSf4TKWxEaNQNFgDKq-OC7kMQ4'}], 'enabled': False}",6,False,,,False,6,,{},"Apparently this a pretty important concept in game theory and economics, so what are some of your favorite modern takes on using a Zero Sum ""point accumulation"" objective to create tension and drive excitement in a game? I'll give my favorite two.

[Jaipur](https://boardgamegeek.com/boardgame/54043/jaipur): a 2 player set collection situation where at the start of the game both players are looking at nearly all the points available, and trying to grab up as much of those points as they can. The race is created because by waiting around, you could potentially earn some extra points not included in the zero sum set up, but by striking first you could get bigger points for acting quickly, while at the same time denying those bigger points to your opponent who may be caught on the backfoot because they felt they were better positioned than you to score in that set. It's a game all about timing. While being lucky helps, a keen sense of knowing when to strike can mitigate a lot.

[Hostage Negotiator](https://boardgamegeek.com/boardgame/134253/hostage-negotiator): A very clever design that somehow gets away with using a zero sum point scoring mechanic in a 1 player game. At the start of the game the hostage taker has taken x number of hostages, and it's up to you to save as many as you can as quickly as you can, before the unstable hostage taker kills a number greater than or equal to half of x (although x may have increased in value by this time depending on events.) There is a lot I could say about why I like this game, and I will say that my enjoyment of it definitely increased once I started winning a bit more regularly. The one thing I'll note here, is that typically when I play solitaire games, I never think of myself as playing against an opponent, even if the solitaire version is described as being a ""bot."" I mostly think of the events not directly controlled by me as being luck events I'm having to respond to.  I find I win more often and have more fun when I think in these terms. When I play chess against my phone, I actually DO think of my phone as being something like an intelligent opponent. Even though philosophically I know it's not, in order for me to make the best moves I'm able, it's best if I pretend as though it's an intelligent agent reacting to my moves with designs and plans to foil me. Perhaps if I were in the ballpark of intellect of [Alan Turing](https://en.wikipedia.org/wiki/Turochamp) I would more easily be able to get that sort of experience from a table top game. The reason I bring all this up, is just to compliment Hostage Negotiator on integrating the theme so well into the mechanics, that I sometimes DO feel as though I'm playing against an opponent, and sometimes even win while trying to understand and keep my ""opponents"" motives in mind. There's so much dice involved that this could be chalked up to coincidence, but it makes for a fun experience either way.","&lt;!-- SC_OFF --&gt;&lt;div class=""md""&gt;&lt;p&gt;Apparently this a pretty important concept in game theory and economics, so what are some of your favorite modern takes on using a Zero Sum &amp;quot;point accumulation&amp;quot; objective to create tension and drive excitement in a game? I&amp;#39;ll give my favorite two.&lt;/p&gt;

&lt;p&gt;&lt;a href=""https://boardgamegeek.com/boardgame/54043/jaipur""&gt;Jaipur&lt;/a&gt;: a 2 player set collection situation where at the start of the game both players are looking at nearly all the points available, and trying to grab up as much of those points as they can. The race is created because by waiting around, you could potentially earn some extra points not included in the zero sum set up, but by striking first you could get bigger points for acting quickly, while at the same time denying those bigger points to your opponent who may be caught on the backfoot because they felt they were better positioned than you to score in that set. It&amp;#39;s a game all about timing. While being lucky helps, a keen sense of knowing when to strike can mitigate a lot.&lt;/p&gt;

&lt;p&gt;&lt;a href=""https://boardgamegeek.com/boardgame/134253/hostage-negotiator""&gt;Hostage Negotiator&lt;/a&gt;: A very clever design that somehow gets away with using a zero sum point scoring mechanic in a 1 player game. At the start of the game the hostage taker has taken x number of hostages, and it&amp;#39;s up to you to save as many as you can as quickly as you can, before the unstable hostage taker kills a number greater than or equal to half of x (although x may have increased in value by this time depending on events.) There is a lot I could say about why I like this game, and I will say that my enjoyment of it definitely increased once I started winning a bit more regularly. The one thing I&amp;#39;ll note here, is that typically when I play solitaire games, I never think of myself as playing against an opponent, even if the solitaire version is described as being a &amp;quot;bot.&amp;quot; I mostly think of the events not directly controlled by me as being luck events I&amp;#39;m having to respond to.  I find I win more often and have more fun when I think in these terms. When I play chess against my phone, I actually DO think of my phone as being something like an intelligent opponent. Even though philosophically I know it&amp;#39;s not, in order for me to make the best moves I&amp;#39;m able, it&amp;#39;s best if I pretend as though it&amp;#39;s an intelligent agent reacting to my moves with designs and plans to foil me. Perhaps if I were in the ballpark of intellect of &lt;a href=""https://en.wikipedia.org/wiki/Turochamp""&gt;Alan Turing&lt;/a&gt; I would more easily be able to get that sort of experience from a table top game. The reason I bring all this up, is just to compliment Hostage Negotiator on integrating the theme so well into the mechanics, that I sometimes DO feel as though I&amp;#39;m playing against an opponent, and sometimes even win while trying to understand and keep my &amp;quot;opponents&amp;quot; motives in mind. There&amp;#39;s so much dice involved that this could be chalked up to coincidence, but it makes for a fun experience either way.&lt;/p&gt;
&lt;/div&gt;&lt;!-- SC_ON --&gt;",True,False,False,boardgames,t5_2qmjp,r/boardgames,1933285,public,,self,,,Favorite examples of Zero Sum Games?,0,6,https://www.reddit.com/r/boardgames/comments/bxc235/favorite_examples_of_zero_sum_games/,[],,False,all_ads,6
[],,,False,pseudokojo,,fire-in-the-lake,"[{'e': 'text', 't': 'Fizzle in the Lizzle'}]",a7483886-18aa-11e7-a1cb-0ea4121a8698,Fizzle in the Lizzle,dark,richtext,t2_dy5j4,False,,,False,False,,False,,False,1559820759.0,1559791959.0,,self.boardgames,0,1559797599.0,0,{},False,False,bxbxr2,False,False,False,False,True,True,False,,,,[],,,dark,text,False,,{},False,,,,[],t3_bxbxr2,False,4,0,,False,all_ads,/r/boardgames/comments/bxbxr2/help_what_is_the_game_i_am_vaguely_remembering_it/,False,self,"{'images': [{'source': {'url': 'https://external-preview.redd.it/v_tedBGUcgD70RI_99H_AAhXoDtk2yW2aNqpwGDRkNs.jpg?auto=webp&amp;s=3f7fd7c07da6e833e0eaa43d28e5fad7f64dc219', 'width': 445, 'height': 445}, 'resolutions': [{'url': 'https://external-preview.redd.it/v_tedBGUcgD70RI_99H_AAhXoDtk2yW2aNqpwGDRkNs.jpg?width=108&amp;crop=smart&amp;auto=webp&amp;s=46fb6d9c61a92847227b40ac44f1e0d6dbff18e9', 'width': 108, 'height': 108}, {'url': 'https://external-preview.redd.it/v_tedBGUcgD70RI_99H_AAhXoDtk2yW2aNqpwGDRkNs.jpg?width=216&amp;crop=smart&amp;auto=webp&amp;s=51be22e5b145caf9db699bf30d4c9e98c2a168d1', 'width': 216, 'height': 216}, {'url': 'https://external-preview.redd.it/v_tedBGUcgD70RI_99H_AAhXoDtk2yW2aNqpwGDRkNs.jpg?width=320&amp;crop=smart&amp;auto=webp&amp;s=5de6b61d51d5decf0be15ba17fbf2222b221469c', 'width': 320, 'height': 320}], 'variants': {}, 'id': 'HNPudJBKzuBLPTO6vZ4T_7D_WGf7AdbvUMvKBIHu1js'}], 'enabled': False}",6,False,,,False,8,,{},"Something like trying to figure out its language?

Thanks for any help.

[Edit] Solved: it was [First Contact](https://boardgamegeek.com/boardgame/258309/first-contact). Thanks /u/michellenc2010 and /u/tankbard","&lt;!-- SC_OFF --&gt;&lt;div class=""md""&gt;&lt;p&gt;Something like trying to figure out its language?&lt;/p&gt;

&lt;p&gt;Thanks for any help.&lt;/p&gt;

&lt;p&gt;[Edit] Solved: it was &lt;a href=""https://boardgamegeek.com/boardgame/258309/first-contact""&gt;First Contact&lt;/a&gt;. Thanks &lt;a href=""/u/michellenc2010""&gt;/u/michellenc2010&lt;/a&gt; and &lt;a href=""/u/tankbard""&gt;/u/tankbard&lt;/a&gt;&lt;/p&gt;
&lt;/div&gt;&lt;!-- SC_ON --&gt;",True,False,False,boardgames,t5_2qmjp,r/boardgames,1933285,public,,self,,,[help] What is the game I am vaguely remembering? It is an unreleased/upcoming title about ancient Egyptians trying to please an alien?,0,8,https://www.reddit.com/r/boardgames/comments/bxbxr2/help_what_is_the_game_i_am_vaguely_remembering_it/,[],,False,all_ads,6
[],,,False,Seamroy,,,[],,,,text,t2_4tt00,False,,,False,False,,False,,False,1559771473.0,1559742673.0,,self.boardgames,0,False,0,{},False,False,bx2siv,False,False,False,False,True,True,False,,,,"[{'e': 'text', 't': 'COMC'}]",734914a6-426b-11e8-8511-0e863647358e,COMC,dark,richtext,False,,{},False,,,,[],t3_bx2siv,False,44,0,,False,all_ads,/r/boardgames/comments/bx2siv/comc_13_years_of_games_and_two_new_shelves/,False,self,"{'images': [{'source': {'url': 'https://external-preview.redd.it/F0kdk79XasxuKDFGq2Y5XfVk6WfJ4xWF8Mjwv6hJHow.jpg?auto=webp&amp;s=5a8c32c245a92fa8ff11c02155a8282e74972112', 'width': 3480, 'height': 4640}, 'resolutions': [{'url': 'https://external-preview.redd.it/F0kdk79XasxuKDFGq2Y5XfVk6WfJ4xWF8Mjwv6hJHow.jpg?width=108&amp;crop=smart&amp;auto=webp&amp;s=31ac31ced5b29c6f084ee57288781ca5acd7181c', 'width': 108, 'height': 144}, {'url': 'https://external-preview.redd.it/F0kdk79XasxuKDFGq2Y5XfVk6WfJ4xWF8Mjwv6hJHow.jpg?width=216&amp;crop=smart&amp;auto=webp&amp;s=bba6bfc6a2fb3f6a9590e11d0ec31280237858c2', 'width': 216, 'height': 288}, {'url': 'https://external-preview.redd.it/F0kdk79XasxuKDFGq2Y5XfVk6WfJ4xWF8Mjwv6hJHow.jpg?width=320&amp;crop=smart&amp;auto=webp&amp;s=9aa1cc53fbf44ec218ccc2ac5c5bc2cc3322f7c0', 'width': 320, 'height': 426}, {'url': 'https://external-preview.redd.it/F0kdk79XasxuKDFGq2Y5XfVk6WfJ4xWF8Mjwv6hJHow.jpg?width=640&amp;crop=smart&amp;auto=webp&amp;s=170171744d08d2140e22c4826dd23a1d0030c7b2', 'width': 640, 'height': 853}, {'url': 'https://external-preview.redd.it/F0kdk79XasxuKDFGq2Y5XfVk6WfJ4xWF8Mjwv6hJHow.jpg?width=960&amp;crop=smart&amp;auto=webp&amp;s=14f0cb830055e5312b3e0977bc2d636384fd7e9e', 'width': 960, 'height': 1280}, {'url': 'https://external-preview.redd.it/F0kdk79XasxuKDFGq2Y5XfVk6WfJ4xWF8Mjwv6hJHow.jpg?width=1080&amp;crop=smart&amp;auto=webp&amp;s=3b0c9d7c89edfeb4e19dd38a907937856da951e5', 'width': 1080, 'height': 1440}], 'variants': {}, 'id': 'GgQOKd6Oi6-VHMfM3IENXr2vFBwco_6CQlIH90NBFJU'}], 'enabled': False}",6,False,,,False,77,,{},"Finally got two shelves setup in the entertainment room and all the games out of various storage solutions. 

Roughly 110 games? A lot are rather small ones and I get gifted those quite frequently.

https://imgur.com/a/uQQAh8P

I started the hobby about 13 years ago when I was at my local FLGS (that I still go to today) and picked up Arkham Horror 2nd Ed.

I really enjoy quite a range of game types, but deckbuilders and RPGs are probably my favorites.

* Favorite Game: Summoner Wars
* War Game: War of the Ring
* RPG: Middara (So far!)
* Family Game: Azul/Mysterium
* Cooperative: Arkham Horror
* Engine Builder: Space Base
* Card: Summoner Wars/Star Realms
* Party Game: Rumble in the Dungeon (House rules!)

Honestly I'd like to get rid of a lot of the games that no longer see play, but a lot are gifted and that always feels bad to sell off for me. 

Ascension is one that I'd clear out once I find a home, played it a ton for a long time but other deckbuilders have come and are much better IMO.

I'll definitely be picking up the Middara KS this month and Tiny Towns once I've had a few more plays of some other games.","&lt;!-- SC_OFF --&gt;&lt;div class=""md""&gt;&lt;p&gt;Finally got two shelves setup in the entertainment room and all the games out of various storage solutions. &lt;/p&gt;

&lt;p&gt;Roughly 110 games? A lot are rather small ones and I get gifted those quite frequently.&lt;/p&gt;

&lt;p&gt;&lt;a href=""https://imgur.com/a/uQQAh8P""&gt;https://imgur.com/a/uQQAh8P&lt;/a&gt;&lt;/p&gt;

&lt;p&gt;I started the hobby about 13 years ago when I was at my local FLGS (that I still go to today) and picked up Arkham Horror 2nd Ed.&lt;/p&gt;

&lt;p&gt;I really enjoy quite a range of game types, but deckbuilders and RPGs are probably my favorites.&lt;/p&gt;

&lt;ul&gt;
&lt;li&gt;Favorite Game: Summoner Wars&lt;/li&gt;
&lt;li&gt;War Game: War of the Ring&lt;/li&gt;
&lt;li&gt;RPG: Middara (So far!)&lt;/li&gt;
&lt;li&gt;Family Game: Azul/Mysterium&lt;/li&gt;
&lt;li&gt;Cooperative: Arkham Horror&lt;/li&gt;
&lt;li&gt;Engine Builder: Space Base&lt;/li&gt;
&lt;li&gt;Card: Summoner Wars/Star Realms&lt;/li&gt;
&lt;li&gt;Party Game: Rumble in the Dungeon (House rules!)&lt;/li&gt;
&lt;/ul&gt;

&lt;p&gt;Honestly I&amp;#39;d like to get rid of a lot of the games that no longer see play, but a lot are gifted and that always feels bad to sell off for me. &lt;/p&gt;

&lt;p&gt;Ascension is one that I&amp;#39;d clear out once I find a home, played it a ton for a long time but other deckbuilders have come and are much better IMO.&lt;/p&gt;

&lt;p&gt;I&amp;#39;ll definitely be picking up the Middara KS this month and Tiny Towns once I&amp;#39;ve had a few more plays of some other games.&lt;/p&gt;
&lt;/div&gt;&lt;!-- SC_ON --&gt;",True,False,False,boardgames,t5_2qmjp,r/boardgames,1933285,public,,self,,,"[COMC] 13 Years of games, and two new shelves!",0,77,https://www.reddit.com/r/boardgames/comments/bx2siv/comc_13_years_of_games_and_two_new_shelves/,[],,False,all_ads,6
