[],,,False,808wave808,,,[],,,,text,t2_9bnxsun,False,,,False,False,,False,,False,1559824211.0,1559795411.0,,self.boardgames,0,False,0,{},False,False,bxcg5h,False,False,False,False,True,True,False,,,,[],,,dark,text,False,,{},False,,,,[],t3_bxcg5h,False,80,0,,False,all_ads,/r/boardgames/comments/bxcg5h/how_to_handle_a_player_who_always_wins_but_ive/,False,,,6,False,,,False,56,,{},"So I have become part of the ""inner circle"" of a larger board game group. It's not like I'm special, but I just happen to be available and like heavy games. Anyway, I've noticed one particular player wins most of the time, so I've started watching him closely to see what he's doing to win. Well turns out I've caught him cheating in a few games to accomplish feats he normally wouldn't be able to. He does this with long AP, which is real, but it sometimes leads to him fiddling around with his player board until he suddenly has the resources to accomplish X task. He'll make and undo moves multiple times a game and it gets so frustrating that we become disengaged and I've seen him ""fidget shuffle"" pieces where they weren't. 

As an example, the other day in **Gaia Project** he didn't have enough resources to make a Research Lab, but after an 8 minute AP turn, not even joking, he suddenly had resources for it. Listen, I challenge any of you to really concentrate on what's going on over an 8 minute turn of someone thinking. Most can't because it's like watching paint dry. Anyway, he almost always beats us by like 40 points and I've seen him cheat at least 4 times in the 5 games I understood the game. Then tonight in **Brass: Lancashire** (Birmingham is better) I saw him take from the top of his discard after another guy made a move. He took this because it was a location to block the other player's next turn. A card even went flying and I noticed that he clearly swapped out in the chaos of him somehow dropping 2 cards? Fortunately he came in third this game.

Fact is I don't have proof other than my own experiences seeing him. I didn't want to fuck up the game night because I was having fun, but between his long AP turns and him cheating, I really don't want to play with him anymore. I don't want to call him out in front of everyone to get into an argument, I don't want things to get into a he/said he/said argument and I don't want things to get physical because I'm an adult and adults who fight are lame. 

I was thinking of messaging the two guys I really like to play games with and letting them know what I have seen and that I won't be playing until he isn't. I'm worried it'll cause me to be pushed out of the group though and shit is tough now and the group is keeping me distracted. What the hell do I do? Call out the cheating and 5+ minute turns, or just deal with it and know that I'll never beat him because he's cheating?","&lt;!-- SC_OFF --&gt;&lt;div class=""md""&gt;&lt;p&gt;So I have become part of the &amp;quot;inner circle&amp;quot; of a larger board game group. It&amp;#39;s not like I&amp;#39;m special, but I just happen to be available and like heavy games. Anyway, I&amp;#39;ve noticed one particular player wins most of the time, so I&amp;#39;ve started watching him closely to see what he&amp;#39;s doing to win. Well turns out I&amp;#39;ve caught him cheating in a few games to accomplish feats he normally wouldn&amp;#39;t be able to. He does this with long AP, which is real, but it sometimes leads to him fiddling around with his player board until he suddenly has the resources to accomplish X task. He&amp;#39;ll make and undo moves multiple times a game and it gets so frustrating that we become disengaged and I&amp;#39;ve seen him &amp;quot;fidget shuffle&amp;quot; pieces where they weren&amp;#39;t. &lt;/p&gt;

&lt;p&gt;As an example, the other day in &lt;strong&gt;Gaia Project&lt;/strong&gt; he didn&amp;#39;t have enough resources to make a Research Lab, but after an 8 minute AP turn, not even joking, he suddenly had resources for it. Listen, I challenge any of you to really concentrate on what&amp;#39;s going on over an 8 minute turn of someone thinking. Most can&amp;#39;t because it&amp;#39;s like watching paint dry. Anyway, he almost always beats us by like 40 points and I&amp;#39;ve seen him cheat at least 4 times in the 5 games I understood the game. Then tonight in &lt;strong&gt;Brass: Lancashire&lt;/strong&gt; (Birmingham is better) I saw him take from the top of his discard after another guy made a move. He took this because it was a location to block the other player&amp;#39;s next turn. A card even went flying and I noticed that he clearly swapped out in the chaos of him somehow dropping 2 cards? Fortunately he came in third this game.&lt;/p&gt;

&lt;p&gt;Fact is I don&amp;#39;t have proof other than my own experiences seeing him. I didn&amp;#39;t want to fuck up the game night because I was having fun, but between his long AP turns and him cheating, I really don&amp;#39;t want to play with him anymore. I don&amp;#39;t want to call him out in front of everyone to get into an argument, I don&amp;#39;t want things to get into a he/said he/said argument and I don&amp;#39;t want things to get physical because I&amp;#39;m an adult and adults who fight are lame. &lt;/p&gt;

&lt;p&gt;I was thinking of messaging the two guys I really like to play games with and letting them know what I have seen and that I won&amp;#39;t be playing until he isn&amp;#39;t. I&amp;#39;m worried it&amp;#39;ll cause me to be pushed out of the group though and shit is tough now and the group is keeping me distracted. What the hell do I do? Call out the cheating and 5+ minute turns, or just deal with it and know that I&amp;#39;ll never beat him because he&amp;#39;s cheating?&lt;/p&gt;
&lt;/div&gt;&lt;!-- SC_ON --&gt;",True,False,False,boardgames,t5_2qmjp,r/boardgames,1933285,public,,self,,,"How to handle a player who ""always wins"" but I've seen cheating?",0,56,https://www.reddit.com/r/boardgames/comments/bxcg5h/how_to_handle_a_player_who_always_wins_but_ive/,[],,False,all_ads,6
[],,,False,emg903,,,[],,,,text,t2_29ugsal0,False,,,False,False,,False,,False,1559901335.0,1559872535.0,,self.boardgames,0,False,0,{},False,False,bxozut,False,False,False,False,True,True,False,,,,[],,,dark,text,False,,{},False,,,,[],t3_bxozut,True,1,0,,False,all_ads,/r/boardgames/comments/bxozut/charterstone_automa_in_game_1_if_playing_solo/,False,,,6,False,,,False,0,,{},Im setting up to play solo and the card that explains automa says not to use automa in game 1 if playing 2+ player. It also says it is necessary for solo play. When do I add automa?,"&lt;!-- SC_OFF --&gt;&lt;div class=""md""&gt;&lt;p&gt;Im setting up to play solo and the card that explains automa says not to use automa in game 1 if playing 2+ player. It also says it is necessary for solo play. When do I add automa?&lt;/p&gt;
&lt;/div&gt;&lt;!-- SC_ON --&gt;",True,False,False,boardgames,t5_2qmjp,r/boardgames,1933285,public,,self,,,Charterstone automa in game 1 if playing solo?,0,0,https://www.reddit.com/r/boardgames/comments/bxozut/charterstone_automa_in_game_1_if_playing_solo/,[],,False,all_ads,6
[],,,False,TheBronzeToe,,,[],,,,text,t2_fenvr,False,,,False,False,,False,,False,1559851363.0,1559822563.0,,self.boardgames,0,1559826480.0,0,{},False,False,bxfx8z,False,False,False,False,True,True,False,,,,[],,,dark,text,False,,{},False,,,,[],t3_bxfx8z,False,24,0,,False,all_ads,/r/boardgames/comments/bxfx8z/what_are_the_best_mechanisms_traits_of_a_sandbox/,False,,,6,False,,,False,12,,{},"I am currently in the brainstorming stages of creating a sandbox boardgame and am looking for some new ideas. I have played Xia, Scythe, TI3/4, and many other sandbox like games. Some characteristics I love, such as the discovery of a new location in scythe or the planetary tokens in TI3. What are some games in this genre that excel on the theme? What are some aspects of sandbox that you dislike?","&lt;!-- SC_OFF --&gt;&lt;div class=""md""&gt;&lt;p&gt;I am currently in the brainstorming stages of creating a sandbox boardgame and am looking for some new ideas. I have played Xia, Scythe, TI3/4, and many other sandbox like games. Some characteristics I love, such as the discovery of a new location in scythe or the planetary tokens in TI3. What are some games in this genre that excel on the theme? What are some aspects of sandbox that you dislike?&lt;/p&gt;
&lt;/div&gt;&lt;!-- SC_ON --&gt;",True,False,False,boardgames,t5_2qmjp,r/boardgames,1933285,public,,self,,,What are the best mechanisms/ traits of a sandbox game?,0,12,https://www.reddit.com/r/boardgames/comments/bxfx8z/what_are_the_best_mechanisms_traits_of_a_sandbox/,[],,False,all_ads,6
[],,,False,Mkhi_Mouse,,custom,"[{'e': 'text', 't': 'Big Trouble in Little China'}]",ef809fb6-18ab-11e7-9e69-0e5a4f06ecbe,Big Trouble in Little China,dark,richtext,t2_3fg7lt,False,,,False,False,,False,,False,1559863031.0,1559834231.0,,self.boardgames,0,False,0,{},False,False,bxhwdi,False,False,False,False,True,True,False,,,,[],,,dark,text,False,,{},False,,,,[],t3_bxhwdi,False,42,0,,False,all_ads,/r/boardgames/comments/bxhwdi/my_board_game_group_keeps_expanding_but_i_want_to/,False,,,6,False,,,False,5,,{},"Hi community! I know this doesn't sound like a problem in general, but was hoping the experienced and wise here could help me out. Basically, I formed a group with a partner (the main host) of a friend of a friend of my wife (it was hard to find gamers in my circle!). It was just 3 of us initially but since a lot of games that we wanted to try out had 4 players, the host added his friend to the group on our second meetup. We all got along and we had a blast so he became a fixture. Then the host added another dude who was also cool but he kinda likes playing one type of game. Anyway Im cool with that (well not really but cool enough because he gets into the games and really amps up the fun factor). So then he also became a fixture because it turns out him and the host were old childhood friends who have reconnected over these game sessions, which im happy for. 

Now for the upcoming sessions I just found out the host just invited another 2 of his friends to join. Now here's the part I find tricky: since im the one supplying 95% of the games we play, do I have any say in determining how big the group gets? The host is the one hosting all sessions because he lives most centrally and does not have a car (and they're all his friends). 

Am I being selfish for trying to keep the group sizes down just so we can play certain games? Perhaps I should be more altruistic and see the larger benefits of social bonding? I've voiced some concerns about the player count but the host brushed it off by saying he can sit it out and share hands but I don't think that would be ideal. Should I just put up and shut up or is there something I can do? Im not a confrontational person so telling the host directly I want him to stop inviting more people would be difficult. Minor point - apart from me, the rest of the group share a long history and I tend to feel left out when they start talking non-game things.

Anyway thanks so much for reading and I hope to hear your own experiences and advice.

Tldr; Am I wrong for wanting the host of our game nights to keep the group small (4-5 players) even though I bring most of the games?","&lt;!-- SC_OFF --&gt;&lt;div class=""md""&gt;&lt;p&gt;Hi community! I know this doesn&amp;#39;t sound like a problem in general, but was hoping the experienced and wise here could help me out. Basically, I formed a group with a partner (the main host) of a friend of a friend of my wife (it was hard to find gamers in my circle!). It was just 3 of us initially but since a lot of games that we wanted to try out had 4 players, the host added his friend to the group on our second meetup. We all got along and we had a blast so he became a fixture. Then the host added another dude who was also cool but he kinda likes playing one type of game. Anyway Im cool with that (well not really but cool enough because he gets into the games and really amps up the fun factor). So then he also became a fixture because it turns out him and the host were old childhood friends who have reconnected over these game sessions, which im happy for. &lt;/p&gt;

&lt;p&gt;Now for the upcoming sessions I just found out the host just invited another 2 of his friends to join. Now here&amp;#39;s the part I find tricky: since im the one supplying 95% of the games we play, do I have any say in determining how big the group gets? The host is the one hosting all sessions because he lives most centrally and does not have a car (and they&amp;#39;re all his friends). &lt;/p&gt;

&lt;p&gt;Am I being selfish for trying to keep the group sizes down just so we can play certain games? Perhaps I should be more altruistic and see the larger benefits of social bonding? I&amp;#39;ve voiced some concerns about the player count but the host brushed it off by saying he can sit it out and share hands but I don&amp;#39;t think that would be ideal. Should I just put up and shut up or is there something I can do? Im not a confrontational person so telling the host directly I want him to stop inviting more people would be difficult. Minor point - apart from me, the rest of the group share a long history and I tend to feel left out when they start talking non-game things.&lt;/p&gt;

&lt;p&gt;Anyway thanks so much for reading and I hope to hear your own experiences and advice.&lt;/p&gt;

&lt;p&gt;Tldr; Am I wrong for wanting the host of our game nights to keep the group small (4-5 players) even though I bring most of the games?&lt;/p&gt;
&lt;/div&gt;&lt;!-- SC_ON --&gt;",True,False,False,boardgames,t5_2qmjp,r/boardgames,1933285,public,,self,,,My board game group keeps expanding but I want to keep it smaller. Could use some friendly advice!,0,5,https://www.reddit.com/r/boardgames/comments/bxhwdi/my_board_game_group_keeps_expanding_but_i_want_to/,[],,False,all_ads,6
[],,,False,AgeofSteamNerd,,,[],,,,text,t2_1okyz2l0,False,,,False,False,,False,,False,1559847975.0,1559819175.0,,self.boardgames,0,False,0,{},False,False,bxffwa,False,False,False,False,True,True,False,,#edeff1,,"[{'e': 'text', 't': 'Question [ANSWERED]'}]",e9f90470-b792-11e8-b19d-0e341b525318,Question [ANSWERED],dark,richtext,False,,{},False,,,,[],t3_bxffwa,False,3,0,,False,all_ads,/r/boardgames/comments/bxffwa/fine_sand_how_to_reset/,False,,,6,False,,,False,11,,{},"I picked up a second hand copy of Fine Sand recently and the game has been played so the decks aren't in the original order.

Is there a list online of the sequence that the cards are originally sorted into?

Thanks","&lt;!-- SC_OFF --&gt;&lt;div class=""md""&gt;&lt;p&gt;I picked up a second hand copy of Fine Sand recently and the game has been played so the decks aren&amp;#39;t in the original order.&lt;/p&gt;

&lt;p&gt;Is there a list online of the sequence that the cards are originally sorted into?&lt;/p&gt;

&lt;p&gt;Thanks&lt;/p&gt;
&lt;/div&gt;&lt;!-- SC_ON --&gt;",True,False,False,boardgames,t5_2qmjp,r/boardgames,1933285,public,,self,,,Fine Sand - How to reset,0,11,https://www.reddit.com/r/boardgames/comments/bxffwa/fine_sand_how_to_reset/,[],,False,all_ads,6
[],,,False,tomvinegar,,space-hulk,"[{'e': 'text', 't': 'Space Hulk'}]",,Space Hulk,dark,richtext,t2_6gbxn,False,,,False,False,,False,,False,1559853693.0,1559824893.0,,self.boardgames,0,False,0,{},False,False,bxg9we,False,False,False,False,True,True,False,,,,[],,,dark,text,False,,{},False,,,,[],t3_bxg9we,False,7,0,,False,all_ads,/r/boardgames/comments/bxg9we/anyone_played_euphoria_ignorance_is_bliss_with_2/,False,,,6,False,,,False,7,,{},"See title: has anyone played the Euphoria expansion with two players? I own and like the base game but wasn't crazy about it with 2. I've read the automa cards in ignorance can be used with 2 and i'm curious if they improve the experience and how much overhead they add? I'm never crazy about a 'fake' third player (e.g. 7 wonders), but can live with simple AI space blocking (e.g Teotihuacan). 

Thanks!","&lt;!-- SC_OFF --&gt;&lt;div class=""md""&gt;&lt;p&gt;See title: has anyone played the Euphoria expansion with two players? I own and like the base game but wasn&amp;#39;t crazy about it with 2. I&amp;#39;ve read the automa cards in ignorance can be used with 2 and i&amp;#39;m curious if they improve the experience and how much overhead they add? I&amp;#39;m never crazy about a &amp;#39;fake&amp;#39; third player (e.g. 7 wonders), but can live with simple AI space blocking (e.g Teotihuacan). &lt;/p&gt;

&lt;p&gt;Thanks!&lt;/p&gt;
&lt;/div&gt;&lt;!-- SC_ON --&gt;",True,False,False,boardgames,t5_2qmjp,r/boardgames,1933285,public,,self,,,Anyone played Euphoria: Ignorance Is Bliss with 2?,0,7,https://www.reddit.com/r/boardgames/comments/bxg9we/anyone_played_euphoria_ignorance_is_bliss_with_2/,[],,False,all_ads,6
[],,,False,matthew0523,,,[],,,,text,t2_dvvix,False,,,False,False,,False,,False,1559822529.0,1559793729.0,,self.boardgames,0,False,0,{},False,False,bxc7dq,False,False,False,False,True,True,False,,,,[],,,dark,text,False,,{},False,,,,[],t3_bxc7dq,False,11,0,,False,all_ads,/r/boardgames/comments/bxc7dq/carcassonne_nostalgia/,False,,,6,False,,,False,28,,{},"Carcassonne is probably the oldest game in my collection having been gifted it over 15 years ago. I recently brought it back to my apartment from home after not playing it for easily 10 years and got it to the table tonight with 3 other people that had never played it. 

God I forgot how cutthroat this game can get while being a very lighthearted game at the same time. The game started out calmly as we placed the river but quickly a large city began to be fought over by all but one of us. The game consisted of primarily vying for single ownership of the massive (what ended up being a 30 point city) city while our 4th player just went about making and completing small cities and monestaries. By the time the mega city was complete there were a total of 5 meeples from 3 different players returned to people's hands with two of us getting points for the city. Once the city was taken care of, control over the farmland was next as it was pretty much one continuous farm that touched almost every completed city. Up until the last tile was placed it was up in the air over who would be crowned master farmer (the player who ended up with control over the farm got 24 points from 8 cities.) 

Not really sure why I stopped playing the game so long ago but I was certainly reminded of how much fun it can be to flip tiles and see if you can screw over your friends who are trying to take over your city. Has anybody ever had this feeling from a game where you hadn't played it in forever but then did and remembered how great it was?","&lt;!-- SC_OFF --&gt;&lt;div class=""md""&gt;&lt;p&gt;Carcassonne is probably the oldest game in my collection having been gifted it over 15 years ago. I recently brought it back to my apartment from home after not playing it for easily 10 years and got it to the table tonight with 3 other people that had never played it. &lt;/p&gt;

&lt;p&gt;God I forgot how cutthroat this game can get while being a very lighthearted game at the same time. The game started out calmly as we placed the river but quickly a large city began to be fought over by all but one of us. The game consisted of primarily vying for single ownership of the massive (what ended up being a 30 point city) city while our 4th player just went about making and completing small cities and monestaries. By the time the mega city was complete there were a total of 5 meeples from 3 different players returned to people&amp;#39;s hands with two of us getting points for the city. Once the city was taken care of, control over the farmland was next as it was pretty much one continuous farm that touched almost every completed city. Up until the last tile was placed it was up in the air over who would be crowned master farmer (the player who ended up with control over the farm got 24 points from 8 cities.) &lt;/p&gt;

&lt;p&gt;Not really sure why I stopped playing the game so long ago but I was certainly reminded of how much fun it can be to flip tiles and see if you can screw over your friends who are trying to take over your city. Has anybody ever had this feeling from a game where you hadn&amp;#39;t played it in forever but then did and remembered how great it was?&lt;/p&gt;
&lt;/div&gt;&lt;!-- SC_ON --&gt;",True,False,False,boardgames,t5_2qmjp,r/boardgames,1933285,public,,self,,,Carcassonne Nostalgia,0,28,https://www.reddit.com/r/boardgames/comments/bxc7dq/carcassonne_nostalgia/,[],,False,all_ads,6
[],,,False,Stuntz-X,,,[],,,,text,t2_zx9er,False,,,False,False,,False,,False,1559871758.0,1559842958.0,,self.boardgames,0,False,0,{},False,False,bxjlxa,False,False,False,False,True,True,False,,#edeff1,,"[{'e': 'text', 't': 'Question'}]",ce696ba0-b792-11e8-9508-0ed1a4fbdca2,Question,dark,richtext,False,,{},False,,,,[],t3_bxjlxa,True,6,0,,False,all_ads,/r/boardgames/comments/bxjlxa/questiondiscussion_board_games_that_can/,False,,,6,False,,,False,2,,{},"Settlers of Catan was a fun game but not many people around me to play often. I found it online and it is exactly what i would hope for in board games online.    A table with the board and pieces all laid out. My hope is that there will be some platform that can take all board games and transition it to that format. Maybe even possible VR.  I don't really want a software game that takes a board game and just makes a game with that concept i want it to just be the exact board game on a  table that you can look around and move paces and snap to spots on board with cards in hand and the such. Not that i don't mind playing board games in real life but there are so many board games out there hard to find people around me that would play that one or are that good at them.  Being online i can find anyone and play anytime.  Just a particular hope of mine.  

Something like Steam for board games where you have a choice of all kinds of Tables.  Then you can pair up with all kinds of people from all over to play board games on that table.  This is something i would love to do. To advanced board games to simple ones. all with the level pf graphics if not better of Catan.    

&amp;#x200B;

Just me wishing there was a way to play some of the lesser known board games out there that seem fun to me but would never have the ability to play because lack of people or their knowledge of said game.","&lt;!-- SC_OFF --&gt;&lt;div class=""md""&gt;&lt;p&gt;Settlers of Catan was a fun game but not many people around me to play often. I found it online and it is exactly what i would hope for in board games online.    A table with the board and pieces all laid out. My hope is that there will be some platform that can take all board games and transition it to that format. Maybe even possible VR.  I don&amp;#39;t really want a software game that takes a board game and just makes a game with that concept i want it to just be the exact board game on a  table that you can look around and move paces and snap to spots on board with cards in hand and the such. Not that i don&amp;#39;t mind playing board games in real life but there are so many board games out there hard to find people around me that would play that one or are that good at them.  Being online i can find anyone and play anytime.  Just a particular hope of mine.  &lt;/p&gt;

&lt;p&gt;Something like Steam for board games where you have a choice of all kinds of Tables.  Then you can pair up with all kinds of people from all over to play board games on that table.  This is something i would love to do. To advanced board games to simple ones. all with the level pf graphics if not better of Catan.    &lt;/p&gt;

&lt;p&gt;&amp;#x200B;&lt;/p&gt;

&lt;p&gt;Just me wishing there was a way to play some of the lesser known board games out there that seem fun to me but would never have the ability to play because lack of people or their knowledge of said game.&lt;/p&gt;
&lt;/div&gt;&lt;!-- SC_ON --&gt;",True,False,False,boardgames,t5_2qmjp,r/boardgames,1933285,public,,self,,,Question/Discussion - Board games that can transitioned to PC - Are there games that managed to do it accurately like Catan? That game did it right by being a board on a table and exactly that.,0,2,https://www.reddit.com/r/boardgames/comments/bxjlxa/questiondiscussion_board_games_that_can/,[],,False,all_ads,6
