[],,,False,esvath,,mechs-and-minions,"[{'e': 'text', 't': 'Mechs And Minions'}]",,Mechs And Minions,dark,richtext,t2_11jxmn,False,,,False,False,,False,,False,1559794614.0,1559765814.0,,self.boardgames,0,False,0,{},False,False,bx7c07,False,False,False,False,True,True,False,,,,[],,,dark,text,False,,{},False,,,,[],t3_bx7c07,False,22,0,,False,all_ads,/r/boardgames/comments/bx7c07/altar_quest_ks_by_the_sadler_brothers_is_offering/,False,,,6,False,,,False,10,,{},"Each hero is supposedly play differently based on their own deck, a staple of the ""modular deck system"".

Anyone here has experienced with their other games based on MDS? How different are the heroes in those games?

Thanks!","&lt;!-- SC_OFF --&gt;&lt;div class=""md""&gt;&lt;p&gt;Each hero is supposedly play differently based on their own deck, a staple of the &amp;quot;modular deck system&amp;quot;.&lt;/p&gt;

&lt;p&gt;Anyone here has experienced with their other games based on MDS? How different are the heroes in those games?&lt;/p&gt;

&lt;p&gt;Thanks!&lt;/p&gt;
&lt;/div&gt;&lt;!-- SC_ON --&gt;",True,False,False,boardgames,t5_2qmjp,r/boardgames,1933285,public,,self,,,Altar Quest KS by the Sadler Brothers is offering heroes pack. How different would they be one to another?,0,10,https://www.reddit.com/r/boardgames/comments/bx7c07/altar_quest_ks_by_the_sadler_brothers_is_offering/,[],,False,all_ads,6
[],,,False,Wasteland_Gaming,,,[],,,,text,t2_a7fkgqo,False,,,False,False,,False,,False,1559813404.0,1559784604.0,,self.boardgames,0,False,0,{},False,False,bxaqob,False,False,False,False,True,True,False,,,,[],,,dark,text,False,,{},False,,,,[],t3_bxaqob,True,18,0,,False,all_ads,/r/boardgames/comments/bxaqob/poll_do_you_prefer_game_minis_in_static_poses_or/,False,,,6,False,,,False,5,,{},"We are launching a Kickstarter later this year and trying to decide if our minis are going to have separate arms, legs, ... so you can customize how your mini is posed.","&lt;!-- SC_OFF --&gt;&lt;div class=""md""&gt;&lt;p&gt;We are launching a Kickstarter later this year and trying to decide if our minis are going to have separate arms, legs, ... so you can customize how your mini is posed.&lt;/p&gt;
&lt;/div&gt;&lt;!-- SC_ON --&gt;",True,False,False,boardgames,t5_2qmjp,r/boardgames,1933285,public,,self,,,Poll: Do you prefer game minis in static poses or in customizable pieces?,0,5,https://www.reddit.com/r/boardgames/comments/bxaqob/poll_do_you_prefer_game_minis_in_static_poses_or/,[],,False,all_ads,6
[],,,False,Carvtographer,,,[],,,,text,t2_1lon52mo,False,,,False,False,,False,,False,1559818139.0,1559789339.0,,self.boardgames,0,1559792513.0,0,{},False,False,bxbj7h,False,False,False,False,True,True,False,,#edeff1,,"[{'e': 'text', 't': 'Question'}]",ce696ba0-b792-11e8-9508-0ed1a4fbdca2,Question,dark,richtext,False,,{},False,,,,[],t3_bxbj7h,True,4,0,,False,all_ads,/r/boardgames/comments/bxbj7h/can_creating_packaging_and_selling_your_game_in_a/,False,,,6,False,,,False,2,,{},"Hey everyone!

Here soon I'm about to finish designing and fixing the kinks/mechanics of my game and I have thought about all the various and different approaches in getting my game into the hands of people, and I wanted to get some people's opinions on what would be the best way to approach this when the time comes.

I hope the title didn't confuse anyone. When I say, 'strictly digital', I'm not meaning taking a game and transitioning it into a 3d-environment as an executable; a la Tabletop Simulator. I mean packaging the game contents, boards, pawns, pieces, into workable file documents (.PSD files, .IND files, pdfs, etc.) and charging people for access to these specific items.

I'm thinking of setting this up on Itch.io as that seems like a great place for people to find new and upcoming games that allow you to essentially deliver .zip files to people that are willing to pay, but I'm also making this post to see if there is another medium or platform that may legitimately support this but do it better. I work full-time, and I don't want to see my game squandered by a publisher that will destroy the theme or rebrand my cards, and I don't have the time or logistical skill-set to complete a Kickstarter campaign at the moment.

I suppose my follow up question would be: does this seem viable to do? I was thinking of making the rulebook free, possibly include a list of all cards as an index and have people who want to play make the cards themselves (assuming they would jump this hurdle to start playing), or if people would pay $5-$10 for a structured page they can print-out and use immediately. This includes printing all the tokens, boards, etc.

Any help is greatly appreciated! Thanks all.

Edit: ""viable"" meaning it would be worth it all to charge or just make it all free.","&lt;!-- SC_OFF --&gt;&lt;div class=""md""&gt;&lt;p&gt;Hey everyone!&lt;/p&gt;

&lt;p&gt;Here soon I&amp;#39;m about to finish designing and fixing the kinks/mechanics of my game and I have thought about all the various and different approaches in getting my game into the hands of people, and I wanted to get some people&amp;#39;s opinions on what would be the best way to approach this when the time comes.&lt;/p&gt;

&lt;p&gt;I hope the title didn&amp;#39;t confuse anyone. When I say, &amp;#39;strictly digital&amp;#39;, I&amp;#39;m not meaning taking a game and transitioning it into a 3d-environment as an executable; a la Tabletop Simulator. I mean packaging the game contents, boards, pawns, pieces, into workable file documents (.PSD files, .IND files, pdfs, etc.) and charging people for access to these specific items.&lt;/p&gt;

&lt;p&gt;I&amp;#39;m thinking of setting this up on Itch.io as that seems like a great place for people to find new and upcoming games that allow you to essentially deliver .zip files to people that are willing to pay, but I&amp;#39;m also making this post to see if there is another medium or platform that may legitimately support this but do it better. I work full-time, and I don&amp;#39;t want to see my game squandered by a publisher that will destroy the theme or rebrand my cards, and I don&amp;#39;t have the time or logistical skill-set to complete a Kickstarter campaign at the moment.&lt;/p&gt;

&lt;p&gt;I suppose my follow up question would be: does this seem viable to do? I was thinking of making the rulebook free, possibly include a list of all cards as an index and have people who want to play make the cards themselves (assuming they would jump this hurdle to start playing), or if people would pay $5-$10 for a structured page they can print-out and use immediately. This includes printing all the tokens, boards, etc.&lt;/p&gt;

&lt;p&gt;Any help is greatly appreciated! Thanks all.&lt;/p&gt;

&lt;p&gt;Edit: &amp;quot;viable&amp;quot; meaning it would be worth it all to charge or just make it all free.&lt;/p&gt;
&lt;/div&gt;&lt;!-- SC_ON --&gt;",True,False,False,boardgames,t5_2qmjp,r/boardgames,1933285,public,,self,,,"Can creating, packaging, and selling your game in a STRICTLY digital format be viable? Is there a platform for this?",0,2,https://www.reddit.com/r/boardgames/comments/bxbj7h/can_creating_packaging_and_selling_your_game_in_a/,[],,False,all_ads,6
[],,,False,four_chambers,,,[],,,,text,t2_3tibp,False,,,False,False,,False,,False,1559785195.0,1559756395.0,,boardgamegeek.com,0,False,0,{},False,False,bx5f5r,False,False,False,False,True,False,False,,,,[],,,dark,text,False,,{},False,,,,[],t3_bx5f5r,False,18,0,,False,all_ads,/r/boardgames/comments/bx5f5r/is_anyone_playing_deck_box_dungeons_they_just/,False,link,"{'images': [{'source': {'url': 'https://external-preview.redd.it/bDVEar9OvBlexr43oo77xVYZYP6LycIILa4QliLj0c8.jpg?auto=webp&amp;s=324cdcd2f62f0f7881a2967587050f7232c28f1e', 'width': 1200, 'height': 630}, 'resolutions': [{'url': 'https://external-preview.redd.it/bDVEar9OvBlexr43oo77xVYZYP6LycIILa4QliLj0c8.jpg?width=108&amp;crop=smart&amp;auto=webp&amp;s=dcf300eb47de14baa03c9bc2299c06ca371e030f', 'width': 108, 'height': 56}, {'url': 'https://external-preview.redd.it/bDVEar9OvBlexr43oo77xVYZYP6LycIILa4QliLj0c8.jpg?width=216&amp;crop=smart&amp;auto=webp&amp;s=3ca48d16585015b4459977c60ba307aed6cd61e3', 'width': 216, 'height': 113}, {'url': 'https://external-preview.redd.it/bDVEar9OvBlexr43oo77xVYZYP6LycIILa4QliLj0c8.jpg?width=320&amp;crop=smart&amp;auto=webp&amp;s=b436b77068ed320408b8abe2285566d634825f69', 'width': 320, 'height': 168}, {'url': 'https://external-preview.redd.it/bDVEar9OvBlexr43oo77xVYZYP6LycIILa4QliLj0c8.jpg?width=640&amp;crop=smart&amp;auto=webp&amp;s=15dac8076de7f078c61363d19d918131a68f92a9', 'width': 640, 'height': 336}, {'url': 'https://external-preview.redd.it/bDVEar9OvBlexr43oo77xVYZYP6LycIILa4QliLj0c8.jpg?width=960&amp;crop=smart&amp;auto=webp&amp;s=991fcbfc97decceeb0b539603ef83aaee24963c8', 'width': 960, 'height': 504}, {'url': 'https://external-preview.redd.it/bDVEar9OvBlexr43oo77xVYZYP6LycIILa4QliLj0c8.jpg?width=1080&amp;crop=smart&amp;auto=webp&amp;s=b4ac326774e8036ba5b73d45b6d172b739cc823d', 'width': 1080, 'height': 567}], 'variants': {}, 'id': 'bViA-d6SUVOGISE1yfwj_cy-00MN8iq6gS79T9njcio'}], 'enabled': False}",6,False,,,False,14,,{},,,True,False,False,boardgames,t5_2qmjp,r/boardgames,1933285,public,,https://b.thumbs.redditmedia.com/-jf_9t9ktEr80R6lnFIUz4fwPHbQ9-NA1yD-mKaD3uE.jpg,73.0,140.0,"Is anyone playing Deck Box Dungeons? They just shipped to people who Kickstarted and preordered, and I played a few games yesterday. It's a dungeon crawler that fits in a deck box, and it's kind of rad as hell",0,14,https://boardgamegeek.com/boardgame/231618/deck-box-dungeons,[],,False,all_ads,6
[],,,False,Alteffor,,monopoly,"[{'e': 'text', 't': 'John Company'}]",3c32c966-18ab-11e7-ac1b-0ea4121a8698,John Company,dark,richtext,t2_4csx3,False,,,False,False,,False,,False,1559774567.0,1559745767.0,,insidegmt.com,0,False,0,{},False,False,bx3cik,False,False,False,False,True,False,False,,,,[],,,dark,text,False,,{},False,,,,[],t3_bx3cik,False,3,0,,False,all_ads,/r/boardgames/comments/bx3cik/the_barracks_emperors_preview_a_trick_taking_tile/,False,link,"{'images': [{'source': {'url': 'https://external-preview.redd.it/qNtfNAf4OH9X03JY3X4r-7ZgKpvWU0QGsmKbsDbWIzI.jpg?auto=webp&amp;s=03a8ab55dc011f90ba18ca29dd51d3f959216772', 'width': 480, 'height': 360}, 'resolutions': [{'url': 'https://external-preview.redd.it/qNtfNAf4OH9X03JY3X4r-7ZgKpvWU0QGsmKbsDbWIzI.jpg?width=108&amp;crop=smart&amp;auto=webp&amp;s=a76c758433e0565f7d6b1785481302e3724ebaf5', 'width': 108, 'height': 81}, {'url': 'https://external-preview.redd.it/qNtfNAf4OH9X03JY3X4r-7ZgKpvWU0QGsmKbsDbWIzI.jpg?width=216&amp;crop=smart&amp;auto=webp&amp;s=0c3ef104186512dad16b022e04fd1ce3e4d447af', 'width': 216, 'height': 162}, {'url': 'https://external-preview.redd.it/qNtfNAf4OH9X03JY3X4r-7ZgKpvWU0QGsmKbsDbWIzI.jpg?width=320&amp;crop=smart&amp;auto=webp&amp;s=0dfc13182a5f07311a6e08de5edbee964b52d66f', 'width': 320, 'height': 240}], 'variants': {}, 'id': '4JuVyhFMx0XOO_ILjHTIOtpQnp6JGZek8PfW9eVK_R8'}], 'enabled': False}",6,False,,,False,19,,{},,,True,False,False,boardgames,t5_2qmjp,r/boardgames,1933285,public,,https://a.thumbs.redditmedia.com/oNF4luHth5KBbpDwqCkOv-j7Pu66tH_juRf1wuTezy4.jpg,105.0,140.0,"The Barracks Emperors Preview - A Trick Taking, Tile Placement War/Euro from the designer of Time of Crisis",0,19,http://www.insidegmt.com/2019/06/the-barracks-emperors-preview/,[],,False,all_ads,6
[],,,False,AutoModerator,#d0fffd,,"[{'e': 'text', 't': 'ðŸ¤–'}]",326005ee-9cf2-11e8-8b1f-0e8f9a199476,ðŸ¤–,dark,richtext,t2_6l4z3,False,,,False,False,,False,,False,1559772849.0,1559744049.0,moderator,self.boardgames,0,False,0,{},False,False,bx319h,False,False,False,False,True,True,False,,#cccd00,,"[{'e': 'text', 't': 'Midweek Mingle'}]",cacc3da2-cd40-11e7-8b75-0e30b487631c,Midweek Mingle,light,richtext,False,,{},False,,,,[],t3_bx319h,True,27,0,,False,all_ads,/r/boardgames/comments/bx319h/midweek_mingle_june_05_2019/,False,,,6,False,,,False,22,,{},"
Looking to post those hauls you're so excited about? Wanna see how many other people here like indie RPGs? Or maybe you brew your own beer or write music or make pottery on the side and ya wanna chat about that? This is your thread.

Consider this our sub's version of going out to happy hour with your coworkers. It's a place to lay back and relax a little.

We will still be enforcing civility (and spam if it's egregious), but otherwise it's open season. Have fun!","&lt;!-- SC_OFF --&gt;&lt;div class=""md""&gt;&lt;p&gt;Looking to post those hauls you&amp;#39;re so excited about? Wanna see how many other people here like indie RPGs? Or maybe you brew your own beer or write music or make pottery on the side and ya wanna chat about that? This is your thread.&lt;/p&gt;

&lt;p&gt;Consider this our sub&amp;#39;s version of going out to happy hour with your coworkers. It&amp;#39;s a place to lay back and relax a little.&lt;/p&gt;

&lt;p&gt;We will still be enforcing civility (and spam if it&amp;#39;s egregious), but otherwise it&amp;#39;s open season. Have fun!&lt;/p&gt;
&lt;/div&gt;&lt;!-- SC_ON --&gt;",False,False,False,boardgames,t5_2qmjp,r/boardgames,1933285,public,,self,,,"Midweek Mingle - (June 05, 2019)",0,22,https://www.reddit.com/r/boardgames/comments/bx319h/midweek_mingle_june_05_2019/,[],,False,all_ads,6
[],,,False,merlinpatt,,,[],,,,text,t2_pexv7,False,,,False,False,,False,,False,1559805603.0,1559776803.0,,self.boardgames,0,False,0,{},False,False,bx9f8x,False,False,False,False,True,True,False,,,,[],,,dark,text,False,,{},False,,,,[],t3_bx9f8x,True,4,0,,False,all_ads,/r/boardgames/comments/bx9f8x/3d_floorplan_for_betrayal_at_the_house_on_the_hill/,False,,,6,False,,,False,3,,{},"I'm looking to enhance my Betrayal game with a 3D floorplan so the different floors can actually be on different floors. If you've seen the 3D chess board in Star Trek, it would be like that.

1. Has anyone seen or made anything like this?
2. What other search terms should I use?
2a. I ask because searching for ""3d floorplan"" has so far returned 3d printed organizers and characters
3. If none exist, what suggestions do you have for building it: materials, design, etc?","&lt;!-- SC_OFF --&gt;&lt;div class=""md""&gt;&lt;p&gt;I&amp;#39;m looking to enhance my Betrayal game with a 3D floorplan so the different floors can actually be on different floors. If you&amp;#39;ve seen the 3D chess board in Star Trek, it would be like that.&lt;/p&gt;

&lt;ol&gt;
&lt;li&gt;Has anyone seen or made anything like this?&lt;/li&gt;
&lt;li&gt;What other search terms should I use?
2a. I ask because searching for &amp;quot;3d floorplan&amp;quot; has so far returned 3d printed organizers and characters&lt;/li&gt;
&lt;li&gt;If none exist, what suggestions do you have for building it: materials, design, etc?&lt;/li&gt;
&lt;/ol&gt;
&lt;/div&gt;&lt;!-- SC_ON --&gt;",True,False,False,boardgames,t5_2qmjp,r/boardgames,1933285,public,,self,,,3D Floorplan for Betrayal at the House on the Hill?,0,3,https://www.reddit.com/r/boardgames/comments/bx9f8x/3d_floorplan_for_betrayal_at_the_house_on_the_hill/,[],,False,all_ads,6
[],,,False,nsoetens,,,[],,,,text,t2_89tx1,False,,,False,False,,False,,False,1559769936.0,1559741136.0,,self.boardgames,0,False,0,{},False,False,bx2j2g,False,False,False,False,True,True,False,,#edeff1,,"[{'e': 'text', 't': 'Question [ANSWERED]'}]",e9f90470-b792-11e8-b19d-0e341b525318,Question [ANSWERED],dark,richtext,False,,{},False,,,,[],t3_bx2j2g,False,30,0,,False,all_ads,/r/boardgames/comments/bx2j2g/formula_d_how_to_overcome_start_position/,False,,,6,False,,,False,19,,{},"So basically I would like to get Formula D more on the table but I like to keep it simple and fast. This means I would opt for the easy basic rules and only go for 1 lap race. However, this seems to mean that the player in pole position has an advantage to any player behind him and so on... My question comes down if there are any good (house) rules to make the game more balanced for each player given the unbalanced starting position?

&amp;#x200B;

I have come across some pointers here and there and I haven't really tried them all:

* Drive with a team of 2 cars. The one in pole also takes the last position with 2nd car, etc. Points are given for each place and player wins with combined highest score.
   * I really like this one as it seems to almost completely be balanced. However, it takes way more time to play a game as everyone has to go x2. Furthermore, it can only be achieved for up to 5 players.
* Give players extra WP (Wear Points) based on their starting position.
   * How many points should a player get for each row/place they are behind at the start? Would it make much of a difference?
* Let the player in last position have catch-up mechanism... For example adding extra spaces to their roll depending on their gear. +3 spaces if they are in 3rd gear (if they want it, and should be told upfront before they roll)
   * Not sure if this benefits enough players in the back and works in time for 1 lap.

So basically my question is simple: Could you make a balanced compensation for Formula D starting positions for basic 1 lap games? I'm interested in any suggestion or house rule and how well it works...","&lt;!-- SC_OFF --&gt;&lt;div class=""md""&gt;&lt;p&gt;So basically I would like to get Formula D more on the table but I like to keep it simple and fast. This means I would opt for the easy basic rules and only go for 1 lap race. However, this seems to mean that the player in pole position has an advantage to any player behind him and so on... My question comes down if there are any good (house) rules to make the game more balanced for each player given the unbalanced starting position?&lt;/p&gt;

&lt;p&gt;&amp;#x200B;&lt;/p&gt;

&lt;p&gt;I have come across some pointers here and there and I haven&amp;#39;t really tried them all:&lt;/p&gt;

&lt;ul&gt;
&lt;li&gt;Drive with a team of 2 cars. The one in pole also takes the last position with 2nd car, etc. Points are given for each place and player wins with combined highest score.

&lt;ul&gt;
&lt;li&gt;I really like this one as it seems to almost completely be balanced. However, it takes way more time to play a game as everyone has to go x2. Furthermore, it can only be achieved for up to 5 players.&lt;/li&gt;
&lt;/ul&gt;&lt;/li&gt;
&lt;li&gt;Give players extra WP (Wear Points) based on their starting position.

&lt;ul&gt;
&lt;li&gt;How many points should a player get for each row/place they are behind at the start? Would it make much of a difference?&lt;/li&gt;
&lt;/ul&gt;&lt;/li&gt;
&lt;li&gt;Let the player in last position have catch-up mechanism... For example adding extra spaces to their roll depending on their gear. +3 spaces if they are in 3rd gear (if they want it, and should be told upfront before they roll)

&lt;ul&gt;
&lt;li&gt;Not sure if this benefits enough players in the back and works in time for 1 lap.&lt;/li&gt;
&lt;/ul&gt;&lt;/li&gt;
&lt;/ul&gt;

&lt;p&gt;So basically my question is simple: Could you make a balanced compensation for Formula D starting positions for basic 1 lap games? I&amp;#39;m interested in any suggestion or house rule and how well it works...&lt;/p&gt;
&lt;/div&gt;&lt;!-- SC_ON --&gt;",True,False,False,boardgames,t5_2qmjp,r/boardgames,1933285,public,,self,,,Formula D: How to overcome start position disadvantage when playing basic gameplay on a single lap?,0,19,https://www.reddit.com/r/boardgames/comments/bx2j2g/formula_d_how_to_overcome_start_position/,[],,False,all_ads,6
[],,,False,brucelapluma,,dinosaur-island,"[{'e': 'text', 't': 'Plumpy Thimble'}]",,Plumpy Thimble,dark,richtext,t2_6uudn,False,,,False,False,,False,,False,1559805246.0,1559776446.0,,youtu.be,0,False,0,{},False,False,bx9d0j,False,False,False,False,True,False,False,,,humor,"[{'e': 'text', 't': 'Humor'}]",a9776760-343a-11e8-a9be-0efe4ba36a8e,Humor,dark,richtext,False,"{'type': 'youtube.com', 'oembed': {'provider_url': 'https://www.youtube.com/', 'version': '1.0', 'title': 'Board Game Dating: Clank! In! Space!', 'type': 'video', 'thumbnail_width': 480, 'height': 338, 'width': 600, 'html': '&lt;iframe width=""600"" height=""338"" src=""https://www.youtube.com/embed/pbPzlKlyJHo?feature=oembed&amp;enablejsapi=1"" frameborder=""0"" allow=""accelerometer; autoplay; encrypted-media; gyroscope; picture-in-picture"" allowfullscreen&gt;&lt;/iframe&gt;', 'author_name': 'Plumpy Thimble', 'provider_name': 'YouTube', 'thumbnail_url': 'https://i.ytimg.com/vi/pbPzlKlyJHo/hqdefault.jpg', 'thumbnail_height': 360, 'author_url': 'https://www.youtube.com/channel/UCiJx8DSjaPwBBlxcfSWvjHg'}}","{'content': '&lt;iframe width=""600"" height=""338"" src=""https://www.youtube.com/embed/pbPzlKlyJHo?feature=oembed&amp;enablejsapi=1"" frameborder=""0"" allow=""accelerometer; autoplay; encrypted-media; gyroscope; picture-in-picture"" allowfullscreen&gt;&lt;/iframe&gt;', 'width': 600, 'scrolling': False, 'height': 338}",False,,,,[],t3_bx9d0j,False,3,0,,False,all_ads,/r/boardgames/comments/bx9d0j/board_game_dating_profile_clank_in_space/,False,rich:video,"{'images': [{'source': {'url': 'https://external-preview.redd.it/bBQ_ez0tqGl5A79KI9-BMHZ5TXTY2pJwNcWb7jtUz5Q.jpg?auto=webp&amp;s=6b1b5f615ff5e0d770ec573716edae2462a398d9', 'width': 480, 'height': 360}, 'resolutions': [{'url': 'https://external-preview.redd.it/bBQ_ez0tqGl5A79KI9-BMHZ5TXTY2pJwNcWb7jtUz5Q.jpg?width=108&amp;crop=smart&amp;auto=webp&amp;s=757bdc560f975d558ee3162906116f584831d806', 'width': 108, 'height': 81}, {'url': 'https://external-preview.redd.it/bBQ_ez0tqGl5A79KI9-BMHZ5TXTY2pJwNcWb7jtUz5Q.jpg?width=216&amp;crop=smart&amp;auto=webp&amp;s=05e863ad41bd2ab0c5b91a4e28cd6b86738acd1a', 'width': 216, 'height': 162}, {'url': 'https://external-preview.redd.it/bBQ_ez0tqGl5A79KI9-BMHZ5TXTY2pJwNcWb7jtUz5Q.jpg?width=320&amp;crop=smart&amp;auto=webp&amp;s=9c377e3e9c3bacaf40b648ac00010427a3685244', 'width': 320, 'height': 240}], 'variants': {}, 'id': 'rCHeKAEdFgptweQN0saZE20-KsGZ6PU54nEBKTVkpb8'}], 'enabled': False}",6,False,,,False,4,"{'type': 'youtube.com', 'oembed': {'provider_url': 'https://www.youtube.com/', 'version': '1.0', 'title': 'Board Game Dating: Clank! In! Space!', 'type': 'video', 'thumbnail_width': 480, 'height': 338, 'width': 600, 'html': '&lt;iframe width=""600"" height=""338"" src=""https://www.youtube.com/embed/pbPzlKlyJHo?feature=oembed&amp;enablejsapi=1"" frameborder=""0"" allow=""accelerometer; autoplay; encrypted-media; gyroscope; picture-in-picture"" allowfullscreen&gt;&lt;/iframe&gt;', 'author_name': 'Plumpy Thimble', 'provider_name': 'YouTube', 'thumbnail_url': 'https://i.ytimg.com/vi/pbPzlKlyJHo/hqdefault.jpg', 'thumbnail_height': 360, 'author_url': 'https://www.youtube.com/channel/UCiJx8DSjaPwBBlxcfSWvjHg'}}","{'content': '&lt;iframe width=""600"" height=""338"" src=""https://www.youtube.com/embed/pbPzlKlyJHo?feature=oembed&amp;enablejsapi=1"" frameborder=""0"" allow=""accelerometer; autoplay; encrypted-media; gyroscope; picture-in-picture"" allowfullscreen&gt;&lt;/iframe&gt;', 'width': 600, 'scrolling': False, 'media_domain_url': 'https://www.redditmedia.com/mediaembed/bx9d0j', 'height': 338}",,,True,False,False,boardgames,t5_2qmjp,r/boardgames,1933285,public,,https://b.thumbs.redditmedia.com/5jNCcGJiZ2dRhqgLnzixm5_J78qDHGxA6Z3v5H6P-8E.jpg,105.0,140.0,Board Game Dating Profile: Clank! In! Space!,0,4,https://youtu.be/pbPzlKlyJHo,[],,False,all_ads,6
